{
  "schema_version": 1,
  "protocol": "openscience-skill-marketplace",
  "skill": {
    "id": "residency-interview-prep",
    "version": "1.0.1",
    "display_name": "residency-interview-prep",
    "summary": "Mock interview preparation tool for residency Match interviews. Generates.",
    "category": "Academic Writing",
    "source": {
      "repository": "https://github.com/aipoch/medical-research-skills",
      "commit": "d92441066ea6259967469be8e0c8c7b6587928ab",
      "path": "scientific-skills/Academic Writing/residency-interview-prep"
    },
    "publisher": {
      "id": "aipoch",
      "name": "AIPOCH",
      "url": "https://aipoch.com/agent-skills"
    },
    "authors": [
      {
        "name": "AIPOCH"
      }
    ],
    "license": {
      "expression": "MIT",
      "evidence": [
        {
          "url": "https://github.com/aipoch/medical-research-skills/blob/d92441066ea6259967469be8e0c8c7b6587928ab/LICENSE",
          "sha256": "92cd32f3b4857f97a3ad6bf276c42dea2e93fd2bb714b08d75a558c9f215f596"
        }
      ],
      "review": {
        "reviewed_by": "Codex",
        "reviewed_on": "2026-09-30"
      }
    },
    "evaluation": {
      "kind": "upstream-self-assessment",
      "score": 85,
      "max_score": 100,
      "report_url": "https://github.com/aipoch/medical-research-skills/blob/d92441066ea6259967469be8e0c8c7b6587928ab/scientific-skills/Academic%20Writing/residency-interview-prep/residency-interview-prep_audit_result_v1.json",
      "evaluated_on": "2026-03-22",
      "evaluator_version": "skill-auditor@1.0",
      "static_score": {
        "score": 88,
        "max_score": 100
      },
      "dynamic_score": {
        "score": 83.6,
        "max_score": 100
      }
    }
  },
  "package": {
    "content_sha256": "8c1fcf2197e41bc638185413be6f82d5ec94329aaefaa4d7265c8a8cbc22185d",
    "file_count": 5,
    "uncompressed_bytes": 25830
  },
  "artifact": {
    "path": "shards/2b2d134141e3d5698b9e174f154599abf13d7ddd3c9060e29ef536399fd82407.zip",
    "sha256": "2b2d134141e3d5698b9e174f154599abf13d7ddd3c9060e29ef536399fd82407",
    "bytes": 17034738,
    "skill_path": "residency-interview-prep"
  }
}
