{
  "schema_version": 1,
  "protocol": "openscience-skill-marketplace",
  "skill": {
    "id": "model-calibration-curve",
    "version": "1.0.0",
    "display_name": "model-calibration-curve",
    "summary": "Use when assessing how well a survival model's predicted probabilities agree with observed outcomes by fitting a Cox model and generating bootstrap calibration curves at one or more prediction horizons from a clinical CSV file. NOT for: nomogram construction, univariate Cox screening, ROC analysis, or decision-curve analysis.",
    "category": "Data Analysis",
    "source": {
      "repository": "https://github.com/aipoch/medical-research-skills",
      "commit": "d92441066ea6259967469be8e0c8c7b6587928ab",
      "path": "awesome-med-research-skills/Data Analysis/model-calibration-curve"
    },
    "publisher": {
      "id": "aipoch",
      "name": "AIPOCH",
      "url": "https://aipoch.com/agent-skills"
    },
    "license": {
      "expression": "Unknown",
      "evidence": [
        {
          "url": "https://github.com/aipoch/medical-research-skills/blob/d92441066ea6259967469be8e0c8c7b6587928ab/LICENSE",
          "sha256": "92cd32f3b4857f97a3ad6bf276c42dea2e93fd2bb714b08d75a558c9f215f596"
        },
        {
          "url": "https://github.com/aipoch/medical-research-skills/blob/d92441066ea6259967469be8e0c8c7b6587928ab/awesome-med-research-skills/Data%20Analysis/model-calibration-curve/SKILL.md",
          "sha256": "1dbdf02a16d4100d4ce39479972ac06432e160d32e6e01789d4f23d7a1d8484f"
        }
      ],
      "review": {
        "reviewed_by": "Codex",
        "reviewed_on": "2026-09-14",
        "exception_reason": "Maintainer explicitly authorizes publication with Unknown on 2026-09-14 while provenance, license coverage or bundled-material redistribution evidence remains unresolved. Unresolved scope: Bundled tests/data/sample_clinical_survival_data.csv contains TCGA identifiers, survival outcomes and derived risk scores. Establish its dataset origin, transformations and redistribution evidence before publication; illustrative SAMPLE IDs in SKILL.md do not establish that the bundled data are synthetic. Original declarations, attributions, source commit/path and all payload bytes are preserved. Unknown is an uncertainty label, not a permission grant or independent safety/accuracy endorsement."
      }
    },
    "evaluation": {
      "kind": "upstream-self-assessment",
      "score": 95,
      "max_score": 100,
      "report_url": "https://github.com/aipoch/medical-research-skills/blob/d92441066ea6259967469be8e0c8c7b6587928ab/awesome-med-research-skills/Data%20Analysis/model-calibration-curve/eval_report_model-calibration-curve_result.json",
      "evaluated_on": "2026-04-27",
      "evaluator_version": "skill-auditor@1.0",
      "static_score": {
        "score": 96,
        "max_score": 100
      },
      "dynamic_score": {
        "score": 94.4,
        "max_score": 100
      }
    }
  },
  "package": {
    "content_sha256": "de617aabe07f90c89a5e8818e668dd5b2db2834670c5670be5edb8ad8698c06c",
    "file_count": 13,
    "uncompressed_bytes": 97860
  },
  "artifact": {
    "path": "shards/8af7a34004c50d378c0395a66bb4d91878109e0c9e2ec913bcd3571818d63b30.zip",
    "sha256": "8af7a34004c50d378c0395a66bb4d91878109e0c9e2ec913bcd3571818d63b30",
    "bytes": 29914343,
    "skill_path": "model-calibration-curve"
  }
}
