{
  "schema_version": 1,
  "protocol": "openscience-skill-marketplace",
  "skill": {
    "id": "faers-multi-drug-soc-planner",
    "version": "1.0.0",
    "display_name": "faers-multi-drug-soc-planner",
    "summary": "Generates complete FAERS-based multi-drug single-SOC safety comparison research designs from a user-provided drug set, comparator, and adverse event domain. Always use this skill when users want to compare safety signals across multiple drugs using FAERS or OpenFDA data within one System Organ Class (SOC) or bounded AE domain. Trigger for:\"FAERS study comparing drugs within one SOC\", \"publishable FAERS safety comparison paper\", \"compare neuropsychiatric adverse events across beta-blockers\", \"Lite/Standard/Advanced FAERS safety plans\", \"active-comparator restricted disproportionality\", \"adjusted ROR logistic regression FAERS\", \"within-class head-to-head drug comparison\", \"pharmacovigilance signal comparison\", \"single-SOC PT-level FAERS design\", or any phrasing like \"I want to compare drug X and drug Y for adverse events in FAERS\" or \"build a comparative pharmacovigilance paper\". Always output four workload configurations (Lite / Standard / Advanced / Publication+) with a recommended primary plan, step-by-step workflow, figure plan, validation strategy, minimal executable version, and publication upgrade path.",
    "category": "Protocol Design",
    "source": {
      "repository": "https://github.com/aipoch/medical-research-skills",
      "commit": "d92441066ea6259967469be8e0c8c7b6587928ab",
      "path": "scientific-skills/Protocol Design/faers-multi-drug-soc-planner"
    },
    "publisher": {
      "id": "aipoch",
      "name": "AIPOCH",
      "url": "https://aipoch.com/agent-skills"
    },
    "authors": [
      {
        "name": "AIPOCH"
      }
    ],
    "license": {
      "expression": "MIT",
      "evidence": [
        {
          "url": "https://github.com/aipoch/medical-research-skills/blob/d92441066ea6259967469be8e0c8c7b6587928ab/LICENSE",
          "sha256": "92cd32f3b4857f97a3ad6bf276c42dea2e93fd2bb714b08d75a558c9f215f596"
        }
      ],
      "review": {
        "reviewed_by": "Codex",
        "reviewed_on": "2026-09-13"
      }
    }
  },
  "package": {
    "content_sha256": "ced178ddf5fb9ae4098461abdac9ad106af4a0129a9b75b78657ff832218b3a2",
    "file_count": 3,
    "uncompressed_bytes": 31348
  },
  "artifact": {
    "path": "shards/fe539b040e93655def3e77f2488b69a153f319072065f701aef6f8076d8bbeb0.zip",
    "sha256": "fe539b040e93655def3e77f2488b69a153f319072065f701aef6f8076d8bbeb0",
    "bytes": 1383584,
    "skill_path": "faers-multi-drug-soc-planner"
  }
}
