{
  "schema_version": 1,
  "protocol": "openscience-skill-marketplace",
  "skill": {
    "id": "lncrna-regulatory-network-construction-analysis",
    "version": "1.0.1",
    "display_name": "lncrna-regulatory-network-construction-analysis",
    "summary": "Use this bioinformatics data analysis skill to construct a database-driven lncRNA-mRNA regulatory network from target lncRNA and/or gene lists by projecting shared miRNA evidence from local ceRNA reference tables. It does not infer networks from expression matrices.",
    "category": "Data Analysis",
    "source": {
      "repository": "https://github.com/aipoch/medical-research-skills",
      "commit": "d92441066ea6259967469be8e0c8c7b6587928ab",
      "path": "awesome-med-research-skills/Data Analysis/lncrna-regulatory-network-construction-analysis"
    },
    "publisher": {
      "id": "aipoch",
      "name": "AIPOCH",
      "url": "https://aipoch.com/agent-skills"
    },
    "authors": [
      {
        "name": "AIPOCH"
      }
    ],
    "license": {
      "expression": "Unknown",
      "evidence": [
        {
          "url": "https://github.com/aipoch/medical-research-skills/blob/d92441066ea6259967469be8e0c8c7b6587928ab/LICENSE",
          "sha256": "92cd32f3b4857f97a3ad6bf276c42dea2e93fd2bb714b08d75a558c9f215f596"
        },
        {
          "url": "https://github.com/aipoch/medical-research-skills/blob/d92441066ea6259967469be8e0c8c7b6587928ab/awesome-med-research-skills/Data%20Analysis/lncrna-regulatory-network-construction-analysis/SKILL.md",
          "sha256": "bf7013ea1f74e1024b6d5c6f379bc2596f0bcd92cd196036365512bea5826ce7"
        }
      ],
      "review": {
        "reviewed_by": "Codex",
        "reviewed_on": "2026-09-30",
        "exception_reason": "Maintainer explicitly authorizes publication with Unknown on 2026-09-14 while provenance, license coverage or bundled-material redistribution evidence remains unresolved. Unresolved scope: Bundled miRDB, miRTarBase and starBase databases require individual origin, applicable license and redistribution evidence review before selection. Original declarations, attributions, source commit/path and all payload bytes are preserved. Unknown is an uncertainty label, not a permission grant or independent safety/accuracy endorsement."
      }
    },
    "evaluation": {
      "kind": "upstream-self-assessment",
      "score": 92,
      "max_score": 100,
      "report_url": "https://github.com/aipoch/medical-research-skills/blob/d92441066ea6259967469be8e0c8c7b6587928ab/awesome-med-research-skills/Data%20Analysis/lncrna-regulatory-network-construction-analysis/eval_report_lncrna-regulatory-network-construction-analysis_result.json",
      "evaluated_on": "2026-04-20",
      "evaluator_version": "skill-auditor@1.0",
      "static_score": {
        "score": 94,
        "max_score": 100
      },
      "dynamic_score": {
        "score": 91.4,
        "max_score": 100
      }
    }
  },
  "package": {
    "content_sha256": "b3dccc8d81af5b278ac2bd5b1ce1037ee7aee467c24b54201dbf1eb59d3e712c",
    "file_count": 25,
    "uncompressed_bytes": 76016784
  },
  "artifact": {
    "path": "shards/96e0bee15398ff148a6f7b7621559d78a91f04db18abf812f38c34fc1cbc321b.zip",
    "sha256": "96e0bee15398ff148a6f7b7621559d78a91f04db18abf812f38c34fc1cbc321b",
    "bytes": 66876850,
    "skill_path": "lncrna-regulatory-network-construction-analysis"
  }
}
