{
  "schema_version": 1,
  "protocol": "openscience-skill-marketplace",
  "skill": {
    "id": "toxicity-structure-alert",
    "version": "1.0.0",
    "display_name": "toxicity-structure-alert",
    "summary": "Analyze data with `toxicity-structure-alert` using a reproducible workflow, explicit validation, and structured outputs for review-ready interpretation.",
    "category": "Data Analysis",
    "source": {
      "repository": "https://github.com/aipoch/medical-research-skills",
      "commit": "d92441066ea6259967469be8e0c8c7b6587928ab",
      "path": "scientific-skills/Data Analysis/toxicity-structure-alert"
    },
    "publisher": {
      "id": "aipoch",
      "name": "AIPOCH",
      "url": "https://aipoch.com/agent-skills"
    },
    "authors": [
      {
        "name": "AIPOCH"
      }
    ],
    "license": {
      "expression": "MIT",
      "evidence": [
        {
          "url": "https://github.com/aipoch/medical-research-skills/blob/d92441066ea6259967469be8e0c8c7b6587928ab/LICENSE",
          "sha256": "92cd32f3b4857f97a3ad6bf276c42dea2e93fd2bb714b08d75a558c9f215f596"
        }
      ],
      "review": {
        "reviewed_by": "Codex",
        "reviewed_on": "2026-09-13"
      }
    },
    "evaluation": {
      "kind": "upstream-self-assessment",
      "score": 86,
      "max_score": 100,
      "report_url": "https://github.com/aipoch/medical-research-skills/blob/d92441066ea6259967469be8e0c8c7b6587928ab/scientific-skills/Data%20Analysis/toxicity-structure-alert/toxicity-structure-alert_audit_result_v2.json",
      "evaluated_on": "2026-03-23",
      "evaluator_version": "skill-auditor@1.0",
      "static_score": {
        "score": 88,
        "max_score": 100
      },
      "dynamic_score": {
        "score": 84.4,
        "max_score": 100
      }
    }
  },
  "package": {
    "content_sha256": "901e7a46fce699882a76f7e7c2b808e8f4c6cb0af2e52594a615e72ef8884525",
    "file_count": 6,
    "uncompressed_bytes": 44384
  },
  "artifact": {
    "path": "shards/363034760dae6778b913abb9de8c2c721e250f5255b4c76346abd49f4a0de2cb.zip",
    "sha256": "363034760dae6778b913abb9de8c2c721e250f5255b4c76346abd49f4a0de2cb",
    "bytes": 1471244,
    "skill_path": "toxicity-structure-alert"
  }
}
