{
  "schema_version": 1,
  "protocol": "openscience-skill-marketplace",
  "skill": {
    "id": "clinical-question-clarifier",
    "version": "1.0.0",
    "display_name": "clinical-question-clarifier",
    "summary": "Clarifies a vague clinical or biomedical research idea into a structured, bounded, searchable, researchable, and testable question. Always use this skill whenever a user has an early-stage clinical or research thought, an over-broad topic, an ill-defined evidence question, or an unclear problem statement that must be translated into a question framing suitable for literature retrieval, evidence synthesis, gap analysis, study design, or downstream protocol planning. Never jump straight to answering the substantive medical question unless the user explicitly asks for that. Focus first on question framing, boundary setting, and downstream-ready formulation.",
    "category": "Evidence Insight",
    "source": {
      "repository": "https://github.com/aipoch/medical-research-skills",
      "commit": "d92441066ea6259967469be8e0c8c7b6587928ab",
      "path": "awesome-med-research-skills/Evidence Insight/clinical-question-clarifier"
    },
    "publisher": {
      "id": "aipoch",
      "name": "AIPOCH",
      "url": "https://aipoch.com/agent-skills"
    },
    "authors": [
      {
        "name": "AIPOCH"
      }
    ],
    "license": {
      "expression": "MIT",
      "evidence": [
        {
          "url": "https://github.com/aipoch/medical-research-skills/blob/d92441066ea6259967469be8e0c8c7b6587928ab/LICENSE",
          "sha256": "92cd32f3b4857f97a3ad6bf276c42dea2e93fd2bb714b08d75a558c9f215f596"
        }
      ],
      "review": {
        "reviewed_by": "Codex",
        "reviewed_on": "2026-09-13"
      }
    },
    "evaluation": {
      "kind": "upstream-self-assessment",
      "score": 90,
      "max_score": 100,
      "report_url": "https://github.com/aipoch/medical-research-skills/blob/d92441066ea6259967469be8e0c8c7b6587928ab/awesome-med-research-skills/Evidence%20Insight/clinical-question-clarifier/eval_report_clinical-question-clarifier_result.json",
      "evaluated_on": "2026-04-22",
      "evaluator_version": "skill-auditor@1.0",
      "static_score": {
        "score": 95,
        "max_score": 100
      },
      "dynamic_score": {
        "score": 86.4,
        "max_score": 100
      }
    }
  },
  "package": {
    "content_sha256": "5447c59e7a2fe5622a6c8081a87cb0b5428a1b3ddc2ec8511c059c42e6d3ebaf",
    "file_count": 13,
    "uncompressed_bytes": 50017
  },
  "artifact": {
    "path": "shards/363034760dae6778b913abb9de8c2c721e250f5255b4c76346abd49f4a0de2cb.zip",
    "sha256": "363034760dae6778b913abb9de8c2c721e250f5255b4c76346abd49f4a0de2cb",
    "bytes": 1471244,
    "skill_path": "clinical-question-clarifier"
  }
}
