{
  "schema_version": 1,
  "protocol": "openscience-skill-marketplace",
  "skill": {
    "id": "anki-card-creator",
    "version": "1.0.0",
    "display_name": "anki-card-creator",
    "summary": "Use anki-card-creator for academic writing workflows that need structured execution, explicit assumptions, and clear output boundaries for study-card generation.",
    "category": "Academic Writing",
    "source": {
      "repository": "https://github.com/aipoch/medical-research-skills",
      "commit": "d92441066ea6259967469be8e0c8c7b6587928ab",
      "path": "scientific-skills/Academic Writing/anki-card-creator"
    },
    "publisher": {
      "id": "aipoch",
      "name": "AIPOCH",
      "url": "https://aipoch.com/agent-skills"
    },
    "authors": [
      {
        "name": "AIPOCH"
      }
    ],
    "license": {
      "expression": "MIT",
      "evidence": [
        {
          "url": "https://github.com/aipoch/medical-research-skills/blob/d92441066ea6259967469be8e0c8c7b6587928ab/LICENSE",
          "sha256": "92cd32f3b4857f97a3ad6bf276c42dea2e93fd2bb714b08d75a558c9f215f596"
        }
      ],
      "review": {
        "reviewed_by": "Codex",
        "reviewed_on": "2026-09-13"
      }
    },
    "evaluation": {
      "kind": "upstream-self-assessment",
      "score": 85,
      "max_score": 100,
      "report_url": "https://github.com/aipoch/medical-research-skills/blob/d92441066ea6259967469be8e0c8c7b6587928ab/scientific-skills/Academic%20Writing/anki-card-creator/anki-card-creator_audit_result_v2.json",
      "evaluated_on": "2026-03-23",
      "evaluator_version": "skill-auditor@1.0",
      "static_score": {
        "score": 88,
        "max_score": 100
      },
      "dynamic_score": {
        "score": 83.6,
        "max_score": 100
      }
    }
  },
  "package": {
    "content_sha256": "fd85290fd6ac995f15fe72fc400d21830be18ae45142b7cd83c076411926808a",
    "file_count": 7,
    "uncompressed_bytes": 27489
  },
  "artifact": {
    "path": "shards/04fe26384dcbf921da2cd3850d445a115fa70108d0edb105df3313f82b7df449.zip",
    "sha256": "04fe26384dcbf921da2cd3850d445a115fa70108d0edb105df3313f82b7df449",
    "bytes": 277617,
    "skill_path": "anki-card-creator"
  }
}
