{
  "schema_version": 1,
  "protocol": "openscience-skill-marketplace",
  "skill": {
    "id": "graphical-abstract-wizard",
    "version": "1.0.0",
    "display_name": "graphical-abstract-wizard",
    "summary": "Generate graphical abstract layout recommendations based on paper abstracts.",
    "category": "Data Analysis",
    "source": {
      "repository": "https://github.com/aipoch/medical-research-skills",
      "commit": "d92441066ea6259967469be8e0c8c7b6587928ab",
      "path": "scientific-skills/Data Analysis/graphical-abstract-wizard"
    },
    "publisher": {
      "id": "aipoch",
      "name": "AIPOCH",
      "url": "https://aipoch.com/agent-skills"
    },
    "authors": [
      {
        "name": "AIPOCH"
      }
    ],
    "license": {
      "expression": "Unknown",
      "evidence": [
        {
          "url": "https://github.com/aipoch/medical-research-skills/blob/d92441066ea6259967469be8e0c8c7b6587928ab/LICENSE",
          "sha256": "92cd32f3b4857f97a3ad6bf276c42dea2e93fd2bb714b08d75a558c9f215f596"
        },
        {
          "url": "https://github.com/aipoch/medical-research-skills/blob/d92441066ea6259967469be8e0c8c7b6587928ab/scientific-skills/Data%20Analysis/graphical-abstract-wizard/SKILL.md",
          "sha256": "ccd6a8bd0503ad9ce30bfc356395e63fb2973406b960f0d0dc5fa033b1078c6f"
        }
      ],
      "review": {
        "reviewed_by": "Codex",
        "reviewed_on": "2026-09-14",
        "exception_reason": "Maintainer explicitly authorizes publication with Unknown on 2026-09-14 while provenance, license coverage or bundled-material redistribution evidence remains unresolved. Unresolved scope: Third-party collection attribution in SKILL.md:206 requires original license and notice evidence review. Original declarations, attributions, source commit/path and all payload bytes are preserved. Unknown is an uncertainty label, not a permission grant or independent safety/accuracy endorsement."
      }
    },
    "evaluation": {
      "kind": "upstream-self-assessment",
      "score": 86,
      "max_score": 100,
      "report_url": "https://github.com/aipoch/medical-research-skills/blob/d92441066ea6259967469be8e0c8c7b6587928ab/scientific-skills/Data%20Analysis/graphical-abstract-wizard/graphical-abstract-wizard_audit_result_v2.json",
      "evaluated_on": "2026-03-22",
      "evaluator_version": "skill-auditor@1.0",
      "static_score": {
        "score": 83,
        "max_score": 100
      },
      "dynamic_score": {
        "score": 87.2,
        "max_score": 100
      }
    }
  },
  "package": {
    "content_sha256": "e26ced03c5ff5b0f62a57c9be3818702fb97080e724de183694174c57e8da55e",
    "file_count": 6,
    "uncompressed_bytes": 57328
  },
  "artifact": {
    "path": "shards/c98bdc1cad7927e4c2810fcf3208cc7bf87446b6f193c7d20004481554973cc7.zip",
    "sha256": "c98bdc1cad7927e4c2810fcf3208cc7bf87446b6f193c7d20004481554973cc7",
    "bytes": 47185344,
    "skill_path": "graphical-abstract-wizard"
  }
}
