{
  "schema_version": 1,
  "protocol": "openscience-skill-marketplace",
  "skill": {
    "id": "contradictory-findings-resolver",
    "version": "1.0.0",
    "display_name": "contradictory-findings-resolver",
    "summary": "Explains why studies on the same biomedical topic reach different or opposing conclusions by auditing differences in population, endpoint definition, sample source, assay or platform, study design, statistical model, adjustment strategy, validation chain, and bias control. It separates true contradiction from apparent contradiction caused by framing or methods. Never fabricate references, PMIDs, DOIs, trial identifiers, dataset details, platform details, study features, or conflict explanations that are not supported by the input.",
    "category": "Evidence Insight",
    "source": {
      "repository": "https://github.com/aipoch/medical-research-skills",
      "commit": "d92441066ea6259967469be8e0c8c7b6587928ab",
      "path": "awesome-med-research-skills/Evidence Insight/contradictory-findings-resolver"
    },
    "publisher": {
      "id": "aipoch",
      "name": "AIPOCH",
      "url": "https://aipoch.com/agent-skills"
    },
    "authors": [
      {
        "name": "AIPOCH"
      }
    ],
    "license": {
      "expression": "MIT",
      "evidence": [
        {
          "url": "https://github.com/aipoch/medical-research-skills/blob/d92441066ea6259967469be8e0c8c7b6587928ab/LICENSE",
          "sha256": "92cd32f3b4857f97a3ad6bf276c42dea2e93fd2bb714b08d75a558c9f215f596"
        }
      ],
      "review": {
        "reviewed_by": "Codex",
        "reviewed_on": "2026-09-13"
      }
    },
    "evaluation": {
      "kind": "upstream-self-assessment",
      "score": 86,
      "max_score": 100,
      "report_url": "https://github.com/aipoch/medical-research-skills/blob/d92441066ea6259967469be8e0c8c7b6587928ab/awesome-med-research-skills/Evidence%20Insight/contradictory-findings-resolver/eval_report_contradictory-findings-resolver_result.json",
      "evaluated_on": "2026-04-22",
      "evaluator_version": "skill-auditor@1.0",
      "static_score": {
        "score": 89,
        "max_score": 100
      },
      "dynamic_score": {
        "score": 83.6,
        "max_score": 100
      }
    }
  },
  "package": {
    "content_sha256": "f0f64d4f1f0c5ce63f83094281e73df157447b972fb2f48619d3f67b3ae62849",
    "file_count": 10,
    "uncompressed_bytes": 39209
  },
  "artifact": {
    "path": "shards/363034760dae6778b913abb9de8c2c721e250f5255b4c76346abd49f4a0de2cb.zip",
    "sha256": "363034760dae6778b913abb9de8c2c721e250f5255b4c76346abd49f4a0de2cb",
    "bytes": 1471244,
    "skill_path": "contradictory-findings-resolver"
  }
}
