{
  "schema_version": 1,
  "protocol": "openscience-skill-marketplace",
  "skill": {
    "id": "chemical-storage-sorter",
    "version": "1.0.0",
    "display_name": "chemical-storage-sorter",
    "summary": "Sort laboratory chemicals into safe storage groups by hazard classification (acids, bases, oxidizers, flammables, toxics). Identifies incompatible pairs, generates storage plans with warnings, and supports OSHA/NFPA compliance for lab safety.",
    "category": "Other",
    "source": {
      "repository": "https://github.com/aipoch/medical-research-skills",
      "commit": "d92441066ea6259967469be8e0c8c7b6587928ab",
      "path": "scientific-skills/Other/chemical-storage-sorter"
    },
    "publisher": {
      "id": "aipoch",
      "name": "AIPOCH",
      "url": "https://aipoch.com/agent-skills"
    },
    "authors": [
      {
        "name": "AIPOCH"
      }
    ],
    "license": {
      "expression": "MIT",
      "evidence": [
        {
          "url": "https://github.com/aipoch/medical-research-skills/blob/d92441066ea6259967469be8e0c8c7b6587928ab/LICENSE",
          "sha256": "92cd32f3b4857f97a3ad6bf276c42dea2e93fd2bb714b08d75a558c9f215f596"
        }
      ],
      "review": {
        "reviewed_by": "Codex",
        "reviewed_on": "2026-09-13"
      }
    },
    "evaluation": {
      "kind": "upstream-self-assessment",
      "score": 85,
      "max_score": 100,
      "report_url": "https://github.com/aipoch/medical-research-skills/blob/d92441066ea6259967469be8e0c8c7b6587928ab/scientific-skills/Other/chemical-storage-sorter/chemical-storage-sorter_audit_result_v2.json",
      "evaluated_on": "2026-03-19",
      "evaluator_version": "skill-auditor@1.0",
      "static_score": {
        "score": 83,
        "max_score": 100
      },
      "dynamic_score": {
        "score": 86.3,
        "max_score": 100
      }
    }
  },
  "package": {
    "content_sha256": "5f81cc7490ebe72970f49e561ab6f6d08d0469058c67298ad15febb5175f9b84",
    "file_count": 4,
    "uncompressed_bytes": 22663
  },
  "artifact": {
    "path": "shards/fe539b040e93655def3e77f2488b69a153f319072065f701aef6f8076d8bbeb0.zip",
    "sha256": "fe539b040e93655def3e77f2488b69a153f319072065f701aef6f8076d8bbeb0",
    "bytes": 1383584,
    "skill_path": "chemical-storage-sorter"
  }
}
