{
  "schema_version": 1,
  "protocol": "openscience-skill-marketplace",
  "skill": {
    "id": "heatmap-beautifier",
    "version": "1.0.1",
    "display_name": "heatmap-beautifier",
    "summary": "Professional beautification tool for gene expression heatmaps, automatically adds clustering trees, color annotation tracks, and intelligently optimizes label layout.",
    "category": "Data Analysis",
    "source": {
      "repository": "https://github.com/aipoch/medical-research-skills",
      "commit": "d92441066ea6259967469be8e0c8c7b6587928ab",
      "path": "scientific-skills/Data Analysis/heatmap-beautifier"
    },
    "publisher": {
      "id": "aipoch",
      "name": "AIPOCH",
      "url": "https://aipoch.com/agent-skills"
    },
    "authors": [
      {
        "name": "AIPOCH"
      }
    ],
    "license": {
      "expression": "MIT",
      "evidence": [
        {
          "url": "https://github.com/aipoch/medical-research-skills/blob/d92441066ea6259967469be8e0c8c7b6587928ab/LICENSE",
          "sha256": "92cd32f3b4857f97a3ad6bf276c42dea2e93fd2bb714b08d75a558c9f215f596"
        }
      ],
      "review": {
        "reviewed_by": "Codex",
        "reviewed_on": "2026-09-30"
      }
    },
    "evaluation": {
      "kind": "upstream-self-assessment",
      "score": 85,
      "max_score": 100,
      "report_url": "https://github.com/aipoch/medical-research-skills/blob/d92441066ea6259967469be8e0c8c7b6587928ab/scientific-skills/Data%20Analysis/heatmap-beautifier/heatmap-beautifier_audit_result_v2.json",
      "evaluated_on": "2026-03-22",
      "evaluator_version": "skill-auditor@1.0",
      "static_score": {
        "score": 87,
        "max_score": 100
      },
      "dynamic_score": {
        "score": 84.2,
        "max_score": 100
      }
    }
  },
  "package": {
    "content_sha256": "de71d2d40433baf8cd2ab2af2fb7b8b3922beeec6b5a2b84b08a30cc495a4767",
    "file_count": 6,
    "uncompressed_bytes": 48666
  },
  "artifact": {
    "path": "shards/96e0bee15398ff148a6f7b7621559d78a91f04db18abf812f38c34fc1cbc321b.zip",
    "sha256": "96e0bee15398ff148a6f7b7621559d78a91f04db18abf812f38c34fc1cbc321b",
    "bytes": 66876850,
    "skill_path": "heatmap-beautifier"
  }
}
