{
  "schema_version": 1,
  "protocol": "openscience-skill-marketplace",
  "skill": {
    "id": "medical-email-polisher",
    "version": "1.0.1",
    "display_name": "medical-email-polisher",
    "summary": "Transforms rough email drafts into polished, professional medical correspondence.",
    "category": "Academic Writing",
    "source": {
      "repository": "https://github.com/aipoch/medical-research-skills",
      "commit": "d92441066ea6259967469be8e0c8c7b6587928ab",
      "path": "scientific-skills/Academic Writing/medical-email-polisher"
    },
    "publisher": {
      "id": "aipoch",
      "name": "AIPOCH",
      "url": "https://aipoch.com/agent-skills"
    },
    "authors": [
      {
        "name": "AIPOCH"
      }
    ],
    "license": {
      "expression": "MIT",
      "evidence": [
        {
          "url": "https://github.com/aipoch/medical-research-skills/blob/d92441066ea6259967469be8e0c8c7b6587928ab/LICENSE",
          "sha256": "92cd32f3b4857f97a3ad6bf276c42dea2e93fd2bb714b08d75a558c9f215f596"
        }
      ],
      "review": {
        "reviewed_by": "Codex",
        "reviewed_on": "2026-09-30"
      }
    },
    "evaluation": {
      "kind": "upstream-self-assessment",
      "score": 85,
      "max_score": 100,
      "report_url": "https://github.com/aipoch/medical-research-skills/blob/d92441066ea6259967469be8e0c8c7b6587928ab/scientific-skills/Academic%20Writing/medical-email-polisher/medical-email-polisher_audit_result_v1.json",
      "evaluated_on": "2026-03-23",
      "evaluator_version": "skill-auditor@1.0",
      "static_score": {
        "score": 88,
        "max_score": 100
      },
      "dynamic_score": {
        "score": 83.6,
        "max_score": 100
      }
    }
  },
  "package": {
    "content_sha256": "73a095a7ca782803e9b22462420804aa3104b8b2a2c01c747d9366b7f24dc14e",
    "file_count": 5,
    "uncompressed_bytes": 24717
  },
  "artifact": {
    "path": "shards/96e0bee15398ff148a6f7b7621559d78a91f04db18abf812f38c34fc1cbc321b.zip",
    "sha256": "96e0bee15398ff148a6f7b7621559d78a91f04db18abf812f38c34fc1cbc321b",
    "bytes": 66876850,
    "skill_path": "medical-email-polisher"
  }
}
