{
  "schema_version": 1,
  "protocol": "openscience-skill-marketplace",
  "skill": {
    "id": "method-gap-detector",
    "version": "1.0.0",
    "display_name": "method-gap-detector",
    "summary": "Detects methodological gaps across study design, analysis, validation, bias control, reproducibility, and implementation readiness within a biomedical research area. Use this skill when a user wants to identify what current studies are still methodologically missing, which weaknesses are most consequential, and what upgrade path would produce a stronger next-step study. Always separate design gaps, analysis gaps, validation gaps, and reproducibility gaps. Never treat technical complexity as methodological rigor.",
    "category": "Evidence Insight",
    "source": {
      "repository": "https://github.com/aipoch/medical-research-skills",
      "commit": "d92441066ea6259967469be8e0c8c7b6587928ab",
      "path": "awesome-med-research-skills/Evidence Insight/method-gap-detector"
    },
    "publisher": {
      "id": "aipoch",
      "name": "AIPOCH",
      "url": "https://aipoch.com/agent-skills"
    },
    "authors": [
      {
        "name": "AIPOCH"
      }
    ],
    "license": {
      "expression": "MIT",
      "evidence": [
        {
          "url": "https://github.com/aipoch/medical-research-skills/blob/d92441066ea6259967469be8e0c8c7b6587928ab/LICENSE",
          "sha256": "92cd32f3b4857f97a3ad6bf276c42dea2e93fd2bb714b08d75a558c9f215f596"
        }
      ],
      "review": {
        "reviewed_by": "Codex",
        "reviewed_on": "2026-09-13"
      }
    },
    "evaluation": {
      "kind": "upstream-self-assessment",
      "score": 87,
      "max_score": 100,
      "report_url": "https://github.com/aipoch/medical-research-skills/blob/d92441066ea6259967469be8e0c8c7b6587928ab/awesome-med-research-skills/Evidence%20Insight/method-gap-detector/eval_report_method-gap-detector_result.json",
      "evaluated_on": "2026-04-22",
      "evaluator_version": "skill-auditor@1.0",
      "static_score": {
        "score": 90,
        "max_score": 100
      },
      "dynamic_score": {
        "score": 84.4,
        "max_score": 100
      }
    }
  },
  "package": {
    "content_sha256": "0cf3ed7805e8349efcd469e51374aecd0d6f75c7f3dcc84b74ea445074e86195",
    "file_count": 10,
    "uncompressed_bytes": 42398
  },
  "artifact": {
    "path": "shards/363034760dae6778b913abb9de8c2c721e250f5255b4c76346abd49f4a0de2cb.zip",
    "sha256": "363034760dae6778b913abb9de8c2c721e250f5255b4c76346abd49f4a0de2cb",
    "bytes": 1471244,
    "skill_path": "method-gap-detector"
  }
}
