{
  "schema_version": 1,
  "protocol": "openscience-skill-marketplace",
  "skill": {
    "id": "multi-omics-clinical-integration-planner",
    "version": "1.0.0",
    "display_name": "multi-omics-clinical-integration-planner",
    "summary": "Designs complete research plans that integrate clinical variables with multi-omics data from a user-provided biomedical direction. Always use this skill whenever a user wants to design, scope, or structure a study that combines clinical variables with transcriptomics, proteomics, metabolomics, epigenomics, or related omics layers for mechanism interpretation, biomarker development, risk stratification, treatment-response analysis, or translational use. It should define the clinical use case, alignment across data layers, feature-reduction and fusion logic, modeling route, mechanism-interpretation layer, validation ladder, and four workload configurations (Lite / Standard / Advanced / Publication+). Never fabricate datasets, accession numbers, sample counts, metadata completeness, platform coverage, literature references, PMIDs, DOIs, or validation status. Always include the mandatory Dataset Disclaimer immediately before any workflow section that mentions datasets or public resources.",
    "category": "Protocol Design",
    "source": {
      "repository": "https://github.com/aipoch/medical-research-skills",
      "commit": "d92441066ea6259967469be8e0c8c7b6587928ab",
      "path": "awesome-med-research-skills/Protocol Design/multi-omics-clinical-integration-planner"
    },
    "publisher": {
      "id": "aipoch",
      "name": "AIPOCH",
      "url": "https://aipoch.com/agent-skills"
    },
    "authors": [
      {
        "name": "AIPOCH"
      }
    ],
    "license": {
      "expression": "MIT",
      "evidence": [
        {
          "url": "https://github.com/aipoch/medical-research-skills/blob/d92441066ea6259967469be8e0c8c7b6587928ab/LICENSE",
          "sha256": "92cd32f3b4857f97a3ad6bf276c42dea2e93fd2bb714b08d75a558c9f215f596"
        }
      ],
      "review": {
        "reviewed_by": "Codex",
        "reviewed_on": "2026-09-13"
      }
    },
    "evaluation": {
      "kind": "upstream-self-assessment",
      "score": 90,
      "max_score": 100,
      "report_url": "https://github.com/aipoch/medical-research-skills/blob/d92441066ea6259967469be8e0c8c7b6587928ab/awesome-med-research-skills/Protocol%20Design/multi-omics-clinical-integration-planner/eval_report_multi-omics-clinical-integration-planner_result.json",
      "evaluated_on": "2026-04-22",
      "evaluator_version": "skill-auditor@1.0",
      "static_score": {
        "score": 93,
        "max_score": 100
      },
      "dynamic_score": {
        "score": 87.7,
        "max_score": 100
      }
    }
  },
  "package": {
    "content_sha256": "e5cf12fbef85b2109604d65253551ec2f1c44b3e1b181ba6cac010a39ec3c466",
    "file_count": 12,
    "uncompressed_bytes": 40064
  },
  "artifact": {
    "path": "shards/630d1b4dab37083d632d924264ae93642b8327521aaa70fbf83de3cc7fd53d61.zip",
    "sha256": "630d1b4dab37083d632d924264ae93642b8327521aaa70fbf83de3cc7fd53d61",
    "bytes": 542522,
    "skill_path": "multi-omics-clinical-integration-planner"
  }
}
