{
  "schema_version": 1,
  "protocol": "openscience-skill-marketplace",
  "skill": {
    "id": "revision-strategy-planner",
    "version": "1.0.1",
    "display_name": "revision-strategy-planner",
    "summary": "Builds prioritized manuscript revision plans for major or minor revisions by separating comments that require experiments, analyses, clarification, restructuring, or wording changes.",
    "category": "Academic Writing",
    "source": {
      "repository": "https://github.com/aipoch/medical-research-skills",
      "commit": "d92441066ea6259967469be8e0c8c7b6587928ab",
      "path": "awesome-med-research-skills/Academic Writing/revision-strategy-planner"
    },
    "publisher": {
      "id": "aipoch",
      "name": "AIPOCH",
      "url": "https://aipoch.com/agent-skills"
    },
    "authors": [
      {
        "name": "AIPOCH"
      }
    ],
    "license": {
      "expression": "MIT",
      "evidence": [
        {
          "url": "https://github.com/aipoch/medical-research-skills/blob/d92441066ea6259967469be8e0c8c7b6587928ab/LICENSE",
          "sha256": "92cd32f3b4857f97a3ad6bf276c42dea2e93fd2bb714b08d75a558c9f215f596"
        }
      ],
      "review": {
        "reviewed_by": "Codex",
        "reviewed_on": "2026-09-30"
      }
    },
    "evaluation": {
      "kind": "upstream-self-assessment",
      "score": 91,
      "max_score": 100,
      "report_url": "https://github.com/aipoch/medical-research-skills/blob/d92441066ea6259967469be8e0c8c7b6587928ab/awesome-med-research-skills/Academic%20Writing/revision-strategy-planner/eval_report_revision-strategy-planner_result.json",
      "evaluated_on": "2026-04-22",
      "evaluator_version": "skill-auditor@1.0",
      "static_score": {
        "score": 92,
        "max_score": 100
      },
      "dynamic_score": {
        "score": 89.6,
        "max_score": 100
      }
    }
  },
  "package": {
    "content_sha256": "dfcf92fb75196cf2a09b2851fa243f5341667c11a1e078976bb8a9d6aa08e4d3",
    "file_count": 10,
    "uncompressed_bytes": 40909
  },
  "artifact": {
    "path": "shards/2b2d134141e3d5698b9e174f154599abf13d7ddd3c9060e29ef536399fd82407.zip",
    "sha256": "2b2d134141e3d5698b9e174f154599abf13d7ddd3c9060e29ef536399fd82407",
    "bytes": 17034738,
    "skill_path": "revision-strategy-planner"
  }
}
