{
  "schema_version": 1,
  "protocol": "openscience-skill-marketplace",
  "skill": {
    "id": "latex-posters",
    "version": "1.0.0",
    "display_name": "latex-posters",
    "summary": "Creates academic-poster writing packages for LaTeX using beamerposter, tikzposter, or baposter. Use when a user needs poster-ready section copy, figure plans, captions, and package-specific layout decisions for conference or thesis posters.",
    "category": "Academic Writing",
    "source": {
      "repository": "https://github.com/aipoch/medical-research-skills",
      "commit": "d92441066ea6259967469be8e0c8c7b6587928ab",
      "path": "scientific-skills/Academic Writing/latex-posters"
    },
    "publisher": {
      "id": "aipoch",
      "name": "AIPOCH",
      "url": "https://aipoch.com/agent-skills"
    },
    "authors": [
      {
        "name": "AIPOCH"
      }
    ],
    "license": {
      "expression": "MIT",
      "evidence": [
        {
          "url": "https://github.com/aipoch/medical-research-skills/blob/d92441066ea6259967469be8e0c8c7b6587928ab/LICENSE",
          "sha256": "92cd32f3b4857f97a3ad6bf276c42dea2e93fd2bb714b08d75a558c9f215f596"
        }
      ],
      "review": {
        "reviewed_by": "Codex",
        "reviewed_on": "2026-09-13"
      }
    },
    "evaluation": {
      "kind": "upstream-self-assessment",
      "score": 86,
      "max_score": 100,
      "report_url": "https://github.com/aipoch/medical-research-skills/blob/d92441066ea6259967469be8e0c8c7b6587928ab/scientific-skills/Academic%20Writing/latex-posters/latex-posters_audit_result_v1.json",
      "evaluated_on": "2026-03-22",
      "evaluator_version": "skill-auditor@1.0",
      "static_score": {
        "score": 83,
        "max_score": 100
      },
      "dynamic_score": {
        "score": 87.6,
        "max_score": 100
      }
    }
  },
  "package": {
    "content_sha256": "40bd4af3f5820b6b66ec30dafc8a2f7c7ecc84997c2bd68ca667d7d2bd99954a",
    "file_count": 13,
    "uncompressed_bytes": 158935
  },
  "artifact": {
    "path": "shards/1ea735cead62d521282de0bf8a672a95515d73332ea4fa7d5d2ccf72eed45995.zip",
    "sha256": "1ea735cead62d521282de0bf8a672a95515d73332ea4fa7d5d2ccf72eed45995",
    "bytes": 342914,
    "skill_path": "latex-posters"
  }
}
