{
  "schema_version": 1,
  "protocol": "openscience-skill-marketplace",
  "skill": {
    "id": "meta-baujat-plot",
    "version": "1.0.0",
    "display_name": "meta-baujat-plot",
    "summary": "Generate Baujat plots for heterogeneity analysis. Identify studies that contribute most to the overall meta-analysis results and heterogeneity, helping discover potential outlier studies. Input meta-analysis data CSV, output Baujat plot PNG and contribution data CSV.",
    "category": "Data Analysis",
    "source": {
      "repository": "https://github.com/aipoch/medical-research-skills",
      "commit": "d92441066ea6259967469be8e0c8c7b6587928ab",
      "path": "scientific-skills/Data Analysis/meta-baujat-plot"
    },
    "publisher": {
      "id": "aipoch",
      "name": "AIPOCH",
      "url": "https://aipoch.com/agent-skills"
    },
    "authors": [
      {
        "name": "AIPOCH"
      }
    ],
    "license": {
      "expression": "MIT",
      "evidence": [
        {
          "url": "https://github.com/aipoch/medical-research-skills/blob/d92441066ea6259967469be8e0c8c7b6587928ab/LICENSE",
          "sha256": "92cd32f3b4857f97a3ad6bf276c42dea2e93fd2bb714b08d75a558c9f215f596"
        }
      ],
      "review": {
        "reviewed_by": "Codex",
        "reviewed_on": "2026-09-13"
      }
    },
    "evaluation": {
      "kind": "upstream-self-assessment",
      "score": 85,
      "max_score": 100,
      "report_url": "https://github.com/aipoch/medical-research-skills/blob/d92441066ea6259967469be8e0c8c7b6587928ab/scientific-skills/Data%20Analysis/meta-baujat-plot/meta-baujat-plot_audit_result_v2.json",
      "evaluated_on": "2026-03-23",
      "evaluator_version": "skill-auditor@1.0",
      "static_score": {
        "score": 83,
        "max_score": 100
      },
      "dynamic_score": {
        "score": 86.6,
        "max_score": 100
      }
    }
  },
  "package": {
    "content_sha256": "559dd4aa033e1f7f88f46c2283eace683cdec3036865bc947259549d63d8b57f",
    "file_count": 5,
    "uncompressed_bytes": 42617
  },
  "artifact": {
    "path": "shards/d8e984a46df1337c13e2a20138efa359b6b22811f3fa8fb4d733bf90eb2a377b.zip",
    "sha256": "d8e984a46df1337c13e2a20138efa359b6b22811f3fa8fb4d733bf90eb2a377b",
    "bytes": 1370201,
    "skill_path": "meta-baujat-plot"
  }
}
