{
  "schema_version": 1,
  "protocol": "openscience-skill-marketplace",
  "skill": {
    "id": "pptx-posters",
    "version": "1.0.0",
    "display_name": "pptx-posters",
    "summary": "Generate PowerPoint presentations and academic posters from paper abstracts or full paper content, with automatic layout optimization and citation formatting.",
    "category": "Other",
    "source": {
      "repository": "https://github.com/aipoch/medical-research-skills",
      "commit": "d92441066ea6259967469be8e0c8c7b6587928ab",
      "path": "scientific-skills/Other/pptx-posters"
    },
    "publisher": {
      "id": "aipoch",
      "name": "AIPOCH",
      "url": "https://aipoch.com/agent-skills"
    },
    "authors": [
      {
        "name": "AIPOCH"
      }
    ],
    "license": {
      "expression": "MIT",
      "evidence": [
        {
          "url": "https://github.com/aipoch/medical-research-skills/blob/d92441066ea6259967469be8e0c8c7b6587928ab/LICENSE",
          "sha256": "92cd32f3b4857f97a3ad6bf276c42dea2e93fd2bb714b08d75a558c9f215f596"
        }
      ],
      "review": {
        "reviewed_by": "Codex",
        "reviewed_on": "2026-09-13"
      }
    },
    "evaluation": {
      "kind": "upstream-self-assessment",
      "score": 85,
      "max_score": 100,
      "report_url": "https://github.com/aipoch/medical-research-skills/blob/d92441066ea6259967469be8e0c8c7b6587928ab/scientific-skills/Other/pptx-posters/pptx-posters_audit_result_v2.json",
      "evaluated_on": "2026-03-19",
      "evaluator_version": "skill-auditor@1.0",
      "static_score": {
        "score": 84,
        "max_score": 100
      },
      "dynamic_score": {
        "score": 86.3,
        "max_score": 100
      }
    }
  },
  "package": {
    "content_sha256": "e5bf5b620a31d17fb6e481a7ace33c874671679e0e20ba7aeb52f6cb55190355",
    "file_count": 5,
    "uncompressed_bytes": 23209
  },
  "artifact": {
    "path": "shards/fe539b040e93655def3e77f2488b69a153f319072065f701aef6f8076d8bbeb0.zip",
    "sha256": "fe539b040e93655def3e77f2488b69a153f319072065f701aef6f8076d8bbeb0",
    "bytes": 1383584,
    "skill_path": "pptx-posters"
  }
}
