{
  "schema_version": 1,
  "protocol": "openscience-skill-marketplace",
  "skill": {
    "id": "study-limitations-drafter",
    "version": "1.0.1",
    "display_name": "study-limitations-drafter",
    "summary": "Use study limitations drafter for academic writing workflows that need structured execution, explicit assumptions, and clear output boundaries.",
    "category": "Academic Writing",
    "source": {
      "repository": "https://github.com/aipoch/medical-research-skills",
      "commit": "d92441066ea6259967469be8e0c8c7b6587928ab",
      "path": "scientific-skills/Academic Writing/study-limitations-drafter"
    },
    "publisher": {
      "id": "aipoch",
      "name": "AIPOCH",
      "url": "https://aipoch.com/agent-skills"
    },
    "authors": [
      {
        "name": "AIPOCH"
      }
    ],
    "license": {
      "expression": "MIT",
      "evidence": [
        {
          "url": "https://github.com/aipoch/medical-research-skills/blob/d92441066ea6259967469be8e0c8c7b6587928ab/LICENSE",
          "sha256": "92cd32f3b4857f97a3ad6bf276c42dea2e93fd2bb714b08d75a558c9f215f596"
        }
      ],
      "review": {
        "reviewed_by": "Codex",
        "reviewed_on": "2026-09-30"
      }
    },
    "evaluation": {
      "kind": "upstream-self-assessment",
      "score": 91,
      "max_score": 100,
      "report_url": "https://github.com/aipoch/medical-research-skills/blob/d92441066ea6259967469be8e0c8c7b6587928ab/scientific-skills/Academic%20Writing/study-limitations-drafter/eval_report_study-limitations-drafter_result.json",
      "evaluated_on": "2026-06-15",
      "evaluator_version": "skill-auditor@1.0",
      "static_score": {
        "score": 98,
        "max_score": 100
      },
      "dynamic_score": {
        "score": 86.6,
        "max_score": 100
      }
    }
  },
  "package": {
    "content_sha256": "30726dde5c476315f89915d81b711c799b86cad8b6bd2155e29213a00c9b73c0",
    "file_count": 6,
    "uncompressed_bytes": 24083
  },
  "artifact": {
    "path": "shards/2b2d134141e3d5698b9e174f154599abf13d7ddd3c9060e29ef536399fd82407.zip",
    "sha256": "2b2d134141e3d5698b9e174f154599abf13d7ddd3c9060e29ef536399fd82407",
    "bytes": 17034738,
    "skill_path": "study-limitations-drafter"
  }
}
