{
  "schema_version": 1,
  "protocol": "openscience-skill-marketplace",
  "skill": {
    "id": "meta-analysis-methods-generator",
    "version": "1.0.1",
    "display_name": "meta-analysis-methods-generator",
    "summary": "Generates the Methods section for a meta-analysis paper, including search strategy, screening, quality assessment, data extraction, and statistical analysis.",
    "category": "Academic Writing",
    "source": {
      "repository": "https://github.com/aipoch/medical-research-skills",
      "commit": "d92441066ea6259967469be8e0c8c7b6587928ab",
      "path": "scientific-skills/Academic Writing/meta-analysis-methods-generator"
    },
    "publisher": {
      "id": "aipoch",
      "name": "AIPOCH",
      "url": "https://aipoch.com/agent-skills"
    },
    "authors": [
      {
        "name": "AIPOCH"
      }
    ],
    "license": {
      "expression": "MIT",
      "evidence": [
        {
          "url": "https://github.com/aipoch/medical-research-skills/blob/d92441066ea6259967469be8e0c8c7b6587928ab/LICENSE",
          "sha256": "92cd32f3b4857f97a3ad6bf276c42dea2e93fd2bb714b08d75a558c9f215f596"
        }
      ],
      "review": {
        "reviewed_by": "Codex",
        "reviewed_on": "2026-09-30"
      }
    },
    "evaluation": {
      "kind": "upstream-self-assessment",
      "score": 90,
      "max_score": 100,
      "report_url": "https://github.com/aipoch/medical-research-skills/blob/d92441066ea6259967469be8e0c8c7b6587928ab/scientific-skills/Academic%20Writing/meta-analysis-methods-generator/eval_report_meta-analysis-methods-generator_result.json",
      "evaluated_on": "2026-06-15",
      "evaluator_version": "skill-auditor@1.0",
      "static_score": {
        "score": 96,
        "max_score": 100
      },
      "dynamic_score": {
        "score": 86.6,
        "max_score": 100
      }
    }
  },
  "package": {
    "content_sha256": "1a721e801217685681885d9dbad51af9551fcf8b3b142e139eb3eafe8602b45d",
    "file_count": 5,
    "uncompressed_bytes": 26266
  },
  "artifact": {
    "path": "shards/96e0bee15398ff148a6f7b7621559d78a91f04db18abf812f38c34fc1cbc321b.zip",
    "sha256": "96e0bee15398ff148a6f7b7621559d78a91f04db18abf812f38c34fc1cbc321b",
    "bytes": 66876850,
    "skill_path": "meta-analysis-methods-generator"
  }
}
